{
  "version": "1.0.0",
  "game_id": "dokdo_arc_webgame",
  "chapter_id": "CH04",
  "title": "상자들의 도시",
  "role": "물류 복원, 이동 인프라 체감, 인간-시스템 갈등 심화",
  "entry_node_id": "MJ-01",
  "exit_node_ids": [
    "MJ-07"
  ],
  "recommended_level": 4,
  "ui_profile": {
    "theme": "munjeong_logistics",
    "special_widgets": [
      "line_status",
      "route_compare",
      "card_auth_state",
      "hazard_overlay"
    ]
  },
  "objectives": [
    {
      "objective_id": "obj_ch04_01",
      "text": "배송 배지와 보안 배지를 확보한다.",
      "required": true,
      "complete_when": [
        "item:itm_delivery_badge>=1",
        "item:itm_security_badge>=1"
      ]
    },
    {
      "objective_id": "obj_ch04_02",
      "text": "판교 진입권을 획득한다.",
      "required": true,
      "complete_when": [
        "item:itm_route_clearance_pangyo>=1"
      ]
    },
    {
      "objective_id": "obj_ch04_03",
      "text": "철도선 또는 배송터널 중 하나를 연다.",
      "required": true,
      "complete_when": [
        "flag:ch04_rail_route|flag:ch04_delivery_route"
      ]
    },
    {
      "objective_id": "obj_ch04_04",
      "text": "터널 매복을 정리한다.",
      "required": false,
      "complete_when": [
        "flag:ch04_tunnel_clear"
      ]
    },
    {
      "objective_id": "obj_ch04_05",
      "text": "선로 장애를 제거한다.",
      "required": false,
      "complete_when": [
        "flag:ch04_rail_jam_fixed"
      ]
    },
    {
      "objective_id": "obj_ch04_06",
      "text": "정비창 거래를 마친다.",
      "required": false,
      "complete_when": [
        "flag:ch04_vendor_bartered"
      ]
    }
  ],
  "nodes": [
    {
      "node_id": "MJ-01",
      "name": "탄천 둑길",
      "node_type": "travel",
      "description": "폐차량과 비닐이 바람에 걸리는 외곽 접근로.",
      "coordinates": {
        "x": 10,
        "y": 78
      },
      "encounter_table_id": "enc_ch04_logistics_floor",
      "loot_table_ids": [
        "lt_global_basic_office"
      ],
      "npc_ids": [],
      "connections": [
        {
          "to": "MJ-02",
          "travel_type": "walk",
          "requires": [],
          "cost": {
            "time": 3,
            "noise": 1,
            "contamination": 1
          }
        },
        {
          "to": "MJ-03",
          "travel_type": "walk",
          "requires": [],
          "cost": {
            "time": 4,
            "noise": 2,
            "contamination": 1
          }
        }
      ],
      "event_ids": [
        "EV_CH04_ENTRY"
      ],
      "revisit_rule": "always",
      "tags": [
        "entry",
        "outdoor"
      ]
    },
    {
      "node_id": "MJ-02",
      "name": "가락 냉장창고",
      "node_type": "branch",
      "description": "냉장 약품과 보급품이 남아 있는 저온 창고.",
      "coordinates": {
        "x": 24,
        "y": 66
      },
      "encounter_table_id": "enc_ch04_logistics_floor",
      "loot_table_ids": [
        "lt_ch04_logistics"
      ],
      "npc_ids": [],
      "connections": [
        {
          "to": "MJ-03",
          "travel_type": "walk",
          "requires": [],
          "cost": {
            "time": 2,
            "noise": 1,
            "contamination": 1
          }
        },
        {
          "to": "MJ-04",
          "travel_type": "service_road",
          "requires": [],
          "cost": {
            "time": 3,
            "noise": 2,
            "contamination": 1
          }
        }
      ],
      "event_ids": [
        "EV_CH04_COLD_AUDIT",
        "EV_CH04_COLD_ALLOC"
      ],
      "revisit_rule": "always",
      "tags": [
        "medicine",
        "loot"
      ]
    },
    {
      "node_id": "MJ-03",
      "name": "자동분류센터 로비",
      "node_type": "safehouse",
      "description": "한소명이 버티는 로비와 내부 지도 콘솔.",
      "coordinates": {
        "x": 38,
        "y": 56
      },
      "loot_table_ids": [
        "lt_ch04_logistics"
      ],
      "npc_ids": [
        "npc_han_somyeong"
      ],
      "connections": [
        {
          "to": "MJ-04",
          "travel_type": "walk",
          "requires": [],
          "cost": {
            "time": 2,
            "noise": 2,
            "contamination": 1
          }
        },
        {
          "to": "MJ-05",
          "travel_type": "walk",
          "requires": [],
          "cost": {
            "time": 3,
            "noise": 3,
            "contamination": 2
          }
        }
      ],
      "event_ids": [
        "EV_CH04_LOBBY_MEET"
      ],
      "revisit_rule": "always",
      "tags": [
        "npc",
        "hub"
      ]
    },
    {
      "node_id": "MJ-04",
      "name": "철도 인계장",
      "node_type": "branch",
      "description": "수서 연결선과 물류 팔레트가 겹치는 하역 구역.",
      "coordinates": {
        "x": 52,
        "y": 44
      },
      "encounter_table_id": "enc_ch04_logistics_floor",
      "loot_table_ids": [
        "lt_ch04_logistics"
      ],
      "npc_ids": [],
      "connections": [
        {
          "to": "MJ-05",
          "travel_type": "service_rail",
          "requires": [],
          "cost": {
            "time": 2,
            "noise": 2,
            "contamination": 1
          }
        },
        {
          "to": "MJ-07",
          "travel_type": "rail_tunnel",
          "requires": [
            "flag:ch04_rail_route"
          ],
          "cost": {
            "time": 3,
            "noise": 3,
            "contamination": 2
          }
        }
      ],
      "event_ids": [
        "EV_CH04_RAIL_JAM",
        "EV_CH04_ROUTE_SELECTION"
      ],
      "revisit_rule": "after_clear",
      "tags": [
        "route",
        "rail"
      ]
    },
    {
      "node_id": "MJ-05",
      "name": "패키지 분류 메인홀",
      "node_type": "danger",
      "description": "컨베이어가 뒤엉킨 메인 분류 라인.",
      "coordinates": {
        "x": 66,
        "y": 48
      },
      "encounter_table_id": "enc_ch04_boss_picker",
      "loot_table_ids": [
        "lt_ch04_logistics"
      ],
      "npc_ids": [],
      "connections": [
        {
          "to": "MJ-06",
          "travel_type": "walk",
          "requires": [],
          "cost": {
            "time": 2,
            "noise": 3,
            "contamination": 1
          }
        },
        {
          "to": "MJ-07",
          "travel_type": "delivery_tunnel",
          "requires": [
            "flag:ch04_delivery_route"
          ],
          "cost": {
            "time": 2,
            "noise": 2,
            "contamination": 2
          }
        }
      ],
      "event_ids": [
        "EV_CH04_LINE_PREP",
        "EV_CH04_LINE_DECISION",
        "EV_CH04_BOSS_PICKER"
      ],
      "revisit_rule": "locked_after_clear",
      "tags": [
        "boss",
        "logistics"
      ]
    },
    {
      "node_id": "MJ-06",
      "name": "보안 사무실",
      "node_type": "exploration",
      "description": "배송/보안 배지와 출입 프로토콜이 남은 실내 구획.",
      "coordinates": {
        "x": 80,
        "y": 40
      },
      "encounter_table_id": "enc_ch04_logistics_floor",
      "loot_table_ids": [
        "lt_ch04_logistics"
      ],
      "npc_ids": [],
      "connections": [
        {
          "to": "MJ-05",
          "travel_type": "walk",
          "requires": [],
          "cost": {
            "time": 2,
            "noise": 1,
            "contamination": 1
          }
        },
        {
          "to": "MJ-07",
          "travel_type": "service_hall",
          "requires": [],
          "cost": {
            "time": 2,
            "noise": 1,
            "contamination": 1
          }
        }
      ],
      "event_ids": [
        "EV_CH04_SECURITY_SWEEP",
        "EV_CH04_SECURITY_BADGES"
      ],
      "revisit_rule": "always",
      "tags": [
        "keycard",
        "main"
      ]
    },
    {
      "node_id": "MJ-07",
      "name": "배송 터널",
      "node_type": "exit",
      "description": "판교 방향으로 이어지는 하부 통로.",
      "coordinates": {
        "x": 92,
        "y": 30
      },
      "loot_table_ids": [],
      "npc_ids": [],
      "connections": [
        {
          "to": "MJ-01",
          "travel_type": "walk",
          "requires": [
            "flag:chapter_04_completed"
          ],
          "cost": {
            "time": 3,
            "noise": 0,
            "contamination": 0
          }
        }
      ],
      "event_ids": [
        "EV_CH04_EXTRACTION"
      ],
      "revisit_rule": "after_clear",
      "tags": [
        "exit",
        "pangyo"
      ]
    }
  ],
  "events": [
    {
      "event_id": "EV_CH04_ENTRY",
      "event_type": "briefing",
      "node_id": "MJ-01",
      "title": "상자들의 도시",
      "repeatable": false,
      "once_per_run": true,
      "priority": 100,
      "conditions": [],
      "presentation": {
        "layout": "dialogue",
        "art_key": "bg_tancheon_embankment",
        "music_key": "industrial_low",
        "widget_overrides": [
          "route_compare",
          "objective_panel"
        ]
      },
      "text": {
        "summary": "판교 외곽 자동봉쇄를 풀려면 문정 물류벨트에서 배송/보안 배지를 확보해야 한다.",
        "body": [
          "이 챕터는 전투보다 동선과 시스템 선택이 더 중요하다.",
          "라인을 다시 돌릴지, 아예 죽여 둘지가 이후 파밍 구조를 바꾼다."
        ]
      },
      "npc_ids": [
        "npc_yoon_haein"
      ],
      "loot_table_ids": [],
      "choices": [
        {
          "choice_id": "ch04_start",
          "label": "물류벨트로 진입한다",
          "conditions": [],
          "preview": "탄천 둑길을 따라 접근한다.",
          "effects": [
            {
              "op": "set_flag",
              "target": "flag:ch04_started",
              "value": true
            }
          ],
          "next_event_id": "EV_CH04_TUNNEL_AMBUSH"
        }
      ],
      "on_enter_effects": [],
      "on_complete_effects": []
    },
    {
      "event_id": "EV_CH04_COLD_ALLOC",
      "event_type": "choice",
      "node_id": "MJ-02",
      "title": "냉장 약품의 향방",
      "repeatable": false,
      "once_per_run": true,
      "priority": 50,
      "conditions": [],
      "presentation": {
        "layout": "choice",
        "art_key": "bg_cold_warehouse",
        "music_key": "cold_hum",
        "widget_overrides": [
          "resource_compare",